{
  "contributor": "格洛可专题研究 / Codex",
  "submitted": "2026-10-09",
  "module": "M04",
  "items": [
    {
      "file": "materials/eia-grid.md",
      "title": "Electricity delivery to consumers",
      "org": "EIA",
      "year": 2026,
      "modules": [
        "M04"
      ],
      "claimed_importance": 7,
      "confidence": "A",
      "summary": "美国本土互联结构与电力输送层级，明确东部、西部和ERCOT；跨互联转移有限而非没有；物理互联不能替代市场调度机构或地方供电公司身份。 本材料用于回答已冻结的电网接入、供电路径、成本责任或价格口径问题。原文路径、访问时间与身份摘要单独登记；受限站点的网页工具正文响应单独标识，不与原始HTML字节身份混淆。数字和机制仅作为待核验研究输入，不能据此关闭研究问题、覆盖既有记录或把规划容量提升为正式投运容量。后续审核须核对地域、服务对象、分期、事实或预测属性，以及与既有事实是否采用同一分母。",
      "key_numbers": [
        {
          "what": "美国本土主要同步互联",
          "value": 3,
          "unit": "个",
          "locator": "Electricity interconnections小节",
          "caliber_note": "本土48州；不含AK/HI；有有限直流联络；定义；截至2026-10-09"
        }
      ],
      "key_statements": []
    },
    {
      "file": "materials/ferc-june.md",
      "title": "FERC Launches Targeted Action to Speed Large Load Integration",
      "org": "FERC",
      "year": 2026,
      "modules": [
        "M04"
      ],
      "claimed_importance": 7,
      "confidence": "A",
      "summary": "2026年6月FERC向所管辖六家RTO/ISO发布大负荷规则改革要求，涉及接入研究、成本转移、共址、灵活负荷与相邻发电；不能把改革要求当作各地统一规则已实施。 本材料用于回答已冻结的电网接入、供电路径、成本责任或价格口径问题。原文路径、访问时间与身份摘要单独登记；受限站点的网页工具正文响应单独标识，不与原始HTML字节身份混淆。数字和机制仅作为待核验研究输入，不能据此关闭研究问题、覆盖既有记录或把规划容量提升为正式投运容量。后续审核须核对地域、服务对象、分期、事实或预测属性，以及与既有事实是否采用同一分母。",
      "key_numbers": [
        {
          "what": "FERC大负荷改革适用区域运营商",
          "value": 6,
          "unit": "家",
          "locator": "正文及The Six Grid Operators",
          "caliber_note": "FERC管辖六家，不含ERCOT；不是六家垂直电力公司；监管行动；2026-06-18"
        }
      ],
      "key_statements": []
    },
    {
      "file": "materials/lbnl-full.md",
      "title": "2024 United States Data Center Energy Usage Report (corrected URL)",
      "org": "LBNL",
      "year": 2024,
      "modules": [
        "M04"
      ],
      "claimed_importance": 7,
      "confidence": "B",
      "summary": "全国数据中心历史用电与2028情景范围；能源、功率和美国总用电占比各有分母，设备、利用率及设施效率带来预测不确定性；AI是整体数据中心的一部分。 本材料用于回答已冻结的电网接入、供电路径、成本责任或价格口径问题。原文路径、访问时间与身份摘要单独登记；受限站点的网页工具正文响应单独标识，不与原始HTML字节身份混淆。数字和机制仅作为待核验研究输入，不能据此关闭研究问题、覆盖既有记录或把规划容量提升为正式投运容量。后续审核须核对地域、服务对象、分期、事实或预测属性，以及与既有事实是否采用同一分母。",
      "key_numbers": [
        {
          "what": "美国数据中心年度用电",
          "value": 58,
          "unit": "TWh",
          "locator": "Executive Summary / Figure ES-1；匹配PDF物理页 7,9,52,58,63,73",
          "caliber_note": "数据中心整体，非AI独有；历史研究估算；2014"
        },
        {
          "what": "美国数据中心年度用电",
          "value": 176,
          "unit": "TWh",
          "locator": "Executive Summary；匹配PDF物理页 6,52,57,76",
          "caliber_note": "总设施能源估算；非全国逐表实测；历史研究估算；2023"
        },
        {
          "what": "美国数据中心用电占美国总用电",
          "value": 4.4,
          "unit": "%",
          "locator": "Executive Summary；匹配PDF物理页 6,52",
          "caliber_note": "分母美国全年总用电；历史研究估算；2023"
        },
        {
          "what": "美国数据中心年度用电预测低端",
          "value": 325,
          "unit": "TWh",
          "locator": "Executive Summary；匹配PDF物理页 7,52",
          "caliber_note": "2024年报告情景低端，不是2026年实际；2024版预测；2028"
        },
        {
          "what": "美国数据中心年度用电预测高端",
          "value": 580,
          "unit": "TWh",
          "locator": "Executive Summary；匹配PDF物理页 7,52",
          "caliber_note": "与低端同一模型情景范围，不做简单平均；2024版预测；2028"
        },
        {
          "what": "美国数据中心占总用电预测低端",
          "value": 6.7,
          "unit": "%",
          "locator": "Executive Summary；匹配PDF物理页 7,52",
          "caliber_note": "分母该报告预测的2028美国总用电；2024版预测；2028"
        },
        {
          "what": "美国数据中心占总用电预测高端",
          "value": 12,
          "unit": "%",
          "locator": "Executive Summary；匹配PDF物理页 7,52",
          "caliber_note": "预测分母；非当前全国占比；2024版预测；2028"
        }
      ],
      "key_statements": []
    },
    {
      "file": "materials/ercot-batch.md",
      "title": "PUCT Approves ERCOT Batch Zero",
      "org": "ERCOT",
      "year": 2026,
      "modules": [
        "M04"
      ],
      "claimed_importance": 7,
      "confidence": "A",
      "summary": "ERCOT大负荷批次研究制度，75MW资格门槛和2027年计划节点；现场供电、可中断安排及后续批次各有条件，不能将申请量当作现有投运需求。 本材料用于回答已冻结的电网接入、供电路径、成本责任或价格口径问题。原文路径、访问时间与身份摘要单独登记；受限站点的网页工具正文响应单独标识，不与原始HTML字节身份混淆。数字和机制仅作为待核验研究输入，不能据此关闭研究问题、覆盖既有记录或把规划容量提升为正式投运容量。后续审核须核对地域、服务对象、分期、事实或预测属性，以及与既有事实是否采用同一分母。",
      "key_numbers": [
        {
          "what": "ERCOT批次研究的大负荷资格规模门槛",
          "value": 75,
          "unit": "MW",
          "locator": "正文第三段 qualified projects",
          "caliber_note": "另须满足资格条件，不是投运IT容量；公布规则；2026-06-18"
        },
        {
          "what": "ERCOT Batch Zero最终输电计划",
          "value": 2027,
          "unit": "年秋季",
          "locator": "正文 transmission plan",
          "caliber_note": "研究/计划时间，不是所有项目投运时间；公布预期节点；2027"
        }
      ],
      "key_statements": []
    },
    {
      "file": "materials/doe-transformer.md",
      "title": "Distribution Transformer Webinar Text Alternative",
      "org": "DOE",
      "year": 2026,
      "modules": [
        "M04",
        "M09"
      ],
      "claimed_importance": 7,
      "confidence": "A",
      "summary": "配电变压器供应与交期的历史调查，2019与2024对照；来源对象是配电变压器，不将历史调查推广为当前所有高压主变设备统一报价或交期。 本材料用于回答已冻结的电网接入、供电路径、成本责任或价格口径问题。原文路径、访问时间与身份摘要单独登记；受限站点的网页工具正文响应单独标识，不与原始HTML字节身份混淆。数字和机制仅作为待核验研究输入，不能据此关闭研究问题、覆盖既有记录或把规划容量提升为正式投运容量。后续审核须核对地域、服务对象、分期、事实或预测属性，以及与既有事实是否采用同一分母。",
      "key_numbers": [
        {
          "what": "配电变压器交期",
          "value": "3—6",
          "unit": "月",
          "locator": "lead time相关段落",
          "caliber_note": "配电变压器，不推广到所有主变压器；DOE转录所述历史调查；2019"
        },
        {
          "what": "配电变压器交期",
          "value": "1—2年以上",
          "unit": "年",
          "locator": "lead time相关段落",
          "caliber_note": "不冒充2026年现货或工厂报价；DOE转录所述历史调查；2024"
        }
      ],
      "key_statements": []
    },
    {
      "file": "materials/scc.md",
      "title": "SCC Data Center Initiatives",
      "org": "Virginia SCC",
      "year": 2026,
      "modules": [
        "M04"
      ],
      "claimed_importance": 7,
      "confidence": "A",
      "summary": "Dominion大型客户GS-5独立费率、长期义务、85%月输配电成本付款和信用不足担保；记录2027签约条件与2016年前客户豁免，区别能源消耗费用和网络固定费用。 本材料用于回答已冻结的电网接入、供电路径、成本责任或价格口径问题。原文路径、访问时间与身份摘要单独登记；受限站点的网页工具正文响应单独标识，不与原始HTML字节身份混淆。数字和机制仅作为待核验研究输入，不能据此关闭研究问题、覆盖既有记录或把规划容量提升为正式投运容量。后续审核须核对地域、服务对象、分期、事实或预测属性，以及与既有事实是否采用同一分母。",
      "key_numbers": [
        {
          "what": "Dominion适用新大型客户最低服务义务",
          "value": 14,
          "unit": "年",
          "locator": "WHAT IS THE MINIMUM CONTRACT OBLIGATION；匹配PDF物理页 1,2",
          "caliber_note": "适用新增大型客户，非全美统一；SCC已公布未来适用条款；2027-01-01及以后签约"
        },
        {
          "what": "Dominion最低月输配电费用承担",
          "value": 85,
          "unit": "%",
          "locator": "WHAT MINIMUM CHARGES WILL APPLY；匹配PDF物理页 1,2",
          "caliber_note": "分母为其服务的输配电成本；2016年前客户豁免；已公布条款；SCC 2026-02-24说明"
        },
        {
          "what": "Dominion信用不足新客户担保上限",
          "value": 60,
          "unit": "%",
          "locator": "WHAT COLLATERAL WILL BE REQUIRED；匹配PDF物理页 1,2",
          "caliber_note": "分母最低合同费用；可能要求而非所有客户必缴；已公布条款；2027-01-01及以后签约"
        }
      ],
      "key_statements": []
    },
    {
      "file": "materials/ohio.md",
      "title": "Data Center Costs 24-0508-EL-ATA",
      "org": "Ohio Consumers Counsel",
      "year": 2026,
      "modules": [
        "M04"
      ],
      "claimed_importance": 7,
      "confidence": "A",
      "summary": "俄亥俄消费者法律代表机构对PUCO2025年数据中心费率决定的说明，包含85%合同容量和最长12年义务；页面后续更新记载行业上诉，不宣称诉讼已终结。 本材料用于回答已冻结的电网接入、供电路径、成本责任或价格口径问题。原文路径、访问时间与身份摘要单独登记；受限站点的网页工具正文响应单独标识，不与原始HTML字节身份混淆。数字和机制仅作为待核验研究输入，不能据此关闭研究问题、覆盖既有记录或把规划容量提升为正式投运容量。后续审核须核对地域、服务对象、分期、事实或预测属性，以及与既有事实是否采用同一分母。",
      "key_numbers": [
        {
          "what": "AEP Ohio新大型数据中心最低合同容量付款",
          "value": 85,
          "unit": "%",
          "locator": "Update段落",
          "caliber_note": "分母合同电力容量，非未消耗的电能；2025-11上诉；监管决定的官方机构说明；2025-07-09决定"
        },
        {
          "what": "AEP Ohio最低容量义务最长期间",
          "value": 12,
          "unit": "年",
          "locator": "Update段落",
          "caliber_note": "最长期限；保留爬坡细节待查完整费率；监管决定的官方机构说明；2025-07-09决定"
        }
      ],
      "key_statements": []
    },
    {
      "file": "materials/jlarc.md",
      "title": "Data Centers in Virginia, Report 598",
      "org": "Virginia JLARC",
      "year": 2024,
      "modules": [
        "M04"
      ],
      "claimed_importance": 7,
      "confidence": "B",
      "summary": "弗吉尼亚州2024年行业研究，既保留数据中心当时承担当前服务成本的反证，也保留增长带来的长期资源与居民成本压力；14—37美元是到2040情景下不变价月增量。 本材料用于回答已冻结的电网接入、供电路径、成本责任或价格口径问题。原文路径、访问时间与身份摘要单独登记；受限站点的网页工具正文响应单独标识，不与原始HTML字节身份混淆。数字和机制仅作为待核验研究输入，不能据此关闭研究问题、覆盖既有记录或把规划容量提升为正式投运容量。后续审核须核对地域、服务对象、分期、事实或预测属性，以及与既有事实是否采用同一分母。",
      "key_numbers": [
        {
          "what": "典型Dominion居民发电及输电月成本增量",
          "value": "14—37",
          "unit": "美元/月（不变价）",
          "locator": "Summary printed v；匹配PDF物理页 9",
          "caliber_note": "特定模型情景，非当前全国涨幅；2024长期情景估算；到2040"
        }
      ],
      "key_statements": [
        {
          "kind": "mechanism",
          "text": "JLARC当时独立成本研究认为当前服务成本已适当分配，同时预测增长提高未来系统成本",
          "quote": "full cost of service",
          "locator": "PDF第9、62页（正文摘要v、44）"
        }
      ]
    },
    {
      "file": "materials/ga-contract.md",
      "title": "OpenAI contract approval and expected customer savings",
      "org": "Georgia Power",
      "year": 2026,
      "modules": [
        "M04"
      ],
      "claimed_importance": 7,
      "confidence": "A",
      "summary": "Georgia Power的2026年OpenAI合同及客户节省预测；3200MW合同需求、最高1000MW灵活承诺与基础设施成本责任；9.5亿美元为大负荷组合未来年度预测。 本材料用于回答已冻结的电网接入、供电路径、成本责任或价格口径问题。原文路径、访问时间与身份摘要单独登记；受限站点的网页工具正文响应单独标识，不与原始HTML字节身份混淆。数字和机制仅作为待核验研究输入，不能据此关闭研究问题、覆盖既有记录或把规划容量提升为正式投运容量。后续审核须核对地域、服务对象、分期、事实或预测属性，以及与既有事实是否采用同一分母。",
      "key_numbers": [
        {
          "what": "Georgia Power大负荷组合客户预计年度节省",
          "value": 9.5,
          "unit": "亿美元/年",